source,raw_text,priority_label
github_scipy,BUG: `spatial` test fail,High
github_scipy,DOC: RigidTransform.as_components doc is incorrect,Low
github_scipy,BUG: stats: docstrings of several discrete distr. methods show unsupported 'scale' parameter,High
github_scipy,"BUG: `special.comb(0, 0, repetition=False) == 0` , not 1",High
github_scipy,"TST, MAINT: boxcox_llf failing again",High
github_scipy,Error download scipy version 1.16.2,High
github_scipy,BUG: interpolate: LinearNDInterpolator slow for large thread counts,High
github_scipy,BUG/TST: stats: New XSLOW failures in stats,High
github_scipy,DEV: add useful tasks/environments to Pixi workspace,Low
github_scipy,DOC: denominator in scipy.stats.kstatvar for var(k2),Low
github_scipy,Wheels for next release,Medium
github_scipy,BUG: linalg: GIL re-enabled when importing `scipy.linalg` on the macOS arm64 conda-forge build,High
github_scipy,DOC: Broadcasting in `stats.quantile`,Low
github_scipy,`test_multivariate` and `test_exponential_integral` failures on a fresh macOS M4 Homebrew-based env,High
github_scipy,"BUG: sparse: Using the `!=` operator forces CSR conversion, which can be bad for performance",High
github_scipy,"TST: Missing tests for `mathieu_even_coef`, `mathieu_odd_coef`",Low
github_scipy,"MAINT, TST: optimize test_input_validation torch failure",High
github_scipy,ENH: sparse.linalg.minres: support complex hermitian matrices,Medium
github_scipy,BUG: Intel oneAPI stops/fails during post cache install,High
github_scipy,Review scipy-release repo,Medium
github_scipy,"BUG: wasserstein_distance raises unexpectedly ""ValueError: object too deep for desired array""",High
github_scipy,"BUG: special: sph_harm_y returns (0+0j) for valid l, m, theta, phi (SciPy 1.16.2)",High
github_scipy,"BUG: make_splrep function parameter ""s"" should be typed as float",High
github_scipy,Tracking issue: Stable ABI support,High
github_scipy,"DOC: ndimage.convolve ""weights"" parameter is ambiguously documented",Low
github_scipy,BUG: sparse: `check_format` does not check for out of bounds `.data` size for csr matrices,High
github_scipy,ENH: multiple vectors input to RegularGridInterpolator.__call__,Medium
github_scipy,ENH: Improve performance of converting csc arrays to csr arrays by avoiding copies when indptr and indices are already the correct dtype,Medium
github_scipy,ENH: linalg: close performance gaps vs `np.linalg`,Medium
github_scipy,"BUG: sparse: cs{cr}_{array,matrix}’s `sum(axis=0|1)` doesn’t interpret `dtype` as it should",High
github_scipy,BUG: scipy.odr.ODR Segmentation Fault with job=1 and Explicit Models,High
github_scipy,ENH: interpolate.RegularGridInterpolator: `eliminate_zeros()` would make fit faster,Medium
github_scipy,"BUG: interpolate.RBFInterpolator: numerically unstable when two y points are very close, leading to extreme errors",High
github_scipy,DOC/DX: `spin ipython --help` missing required use of `--` to pass args to ipython,Medium
github_scipy,DOC: Website flaky the last few days,Low
github_scipy,"DOC: Documenation Site Not Loading (Also, Just Trying to Figure Out if I Can Use Minimize with a Function that Has One Variable But Multiple Other Inputs as Constants",Low
github_scipy,Tracker: Array API support in `scipy.interpolate`,Medium
github_scipy,TST: signal: Add better isolation to alternative backend tests for signal.,Low
github_scipy,BUG: scipy.sparse.linalg.lsmr() uninitialised variable if maxiter=0 and show=True,High
github_scipy,BUG/RFC: signal: inconsistent output dtypes for filter functions with torch backend and float32 default dtype and what should be done about it.,High
github_scipy,QUERY: Fitting 4 parameters beta distribution leads to unexpected parameters,Low
github_scipy,"BUG: `special.expi(inf)` is `nan`, should be `inf`",High
github_scipy,BUG: interpolate: RBFInterpolator gets twice faster with `OPENBLAS_NUM_THREADS=1`,High
github_scipy,QUERY: optimize.fmin_slsqp: constraints are being ignored,Low
github_scipy,QUERY: Problem when installing with MSYS2 toolchain,Medium
github_scipy,TST: test_as_euler_symmetric_axes tol with torch,Low
github_scipy,BUG: integrate: benchmark integrate.CubatureOscillatory.time_plain timeout,High
github_scipy,TST: `FAILED scipy/linalg/tests/test_matfuncs.py::TestLogM::test_no_ZeroDivisionError`,Medium
github_scipy,BUG: `stats/tests/test_axis_nan_policy.py::test_axis_nan_policy_axis_is_None`,High
github_scipy,BUG: `signal/tests/test_short_time_fft.py::test_closest_STFT_dual_window_roundtrip`,High
github_scipy,TST: `FAILED scipy/stats/tests/test_continuous.py::TestDistributions::test_funcs[logcdf-methods10-x-Binomial]`,Medium
github_scipy,TST: FAILED scipy/interpolate/tests/test_bary_rational.py::TestAAA::test_spiral_cleanup,Medium
github_scipy,DOC: optimize: typo in LinearConstraint docs,Low
github_scipy,DOC: special: second parameter in the `factorialk` docstring is mislabeled,Low
github_scipy,CI: pyparsing 3.3.0a1 deprecation warnings,Medium
github_scipy,BUG: optimize: COBYLA fails with a combination of fixed bounds and linear or nonlinear constriants,High
github_scipy,"CI: optimize: ""UserWarning: 'where' used without 'out'"" error causes ""mypy (py3.11) & dev deps (py3.14), fast, spin (3.14-dev, false)"" job to fail",High
github_scipy,BUG: Hang in scipy 1.16.2 on macOS x86_64 in scipy.sparse.linalg.eigsh when called after fork,High
github_scipy,BUG: `find_peaks_cwt` sometimes finds troughs in addition to peaks,High
github_scipy,DOC: `BSpline.derivative` returns an invalid `BSpline` control point array,Low
github_scipy,BUG: stats: custom distribution generated from `zipfian` has problem at support endpoint,High
github_scipy,Parallelization of `eig(h)`,Medium
github_scipy,hilbert2 tests skipped until CuPy bugfix is released,High
github_scipy,BUG: `xp_promote` and `xp_result_type` are slow for big tensors because `iter` is slow for tensors,High
github_scipy,BUG: `cobyqa` reports `success` status when `callback` raises `StopIteration`,High
github_scipy,BUG: integrate: `solve_ivp()` provides non C-contiguous Y array when calling user function when method='Radau',High
github_scipy,BUG: `scipy.linalg.solve` raises `ValueError` with batched inputs when `b` is a 1-D array,High
github_scipy,BUG:  `scipy.sparse.linalg.norm` returns `numpy.int64` instead of `float` or `ndarray`,High
github_scipy,ENH: Allow scipy.stats.powerlaw to be defined over arbitrary domains,Medium
github_scipy,BUG: sparse: `csc_array.setdiag()` makes indices unsorted without setting has_sorted_indices to False,High
github_scipy,"CI: meson setup fails with ""invalid int value: 'Sentinel.UNSET'""",High
github_scipy,BUG: `eigh_tridiagonal` doesn't yield correct results under sign inversion of Laplacian,High
github_scipy,BUG: optimize: incorrect termination criteria in minpack LMSTR?,High
github_scipy,BUG: `scipy.linalg.solve` is different depending on OS/architecture,High
github_scipy,CI: figure out plans for lock file updates,Medium
github_scipy,BUG: stats.multivariate_normal: produces different result with the same seed,High
github_scipy,BUG: optimize: crash in win-arm64 CI job in `optimize.root(method='lm')`,High
github_scipy,CI: benchmark job on CircleCI broken due to asv 0.6.5 release,High
github_scipy,DOC: Being clear about the distribution of `scipy.spatial.transform.Rotation.random()`,Low
github_scipy,BUG: COO sparse array does not save/load correctly for >2D,High
github_scipy,"BUG: ´find_peaks_cwt´: Bad signal estimate hurts SNR, quality of output",High
github_scipy,TST: adapt to NumPy warning change (mean of empty slice),Low
github_scipy,ENH: spatial: add an equivalent to MATLAB's inpolygon,Medium
github_scipy,DOC: wrong version for stats.f_oneway's equal_var parameter,Low
github_scipy,BUG: io.netcdf_file: 32 bit int used instead of 64 bit,High
github_scipy,DOC: spmatrix argument to scipy.io.loadmat,Low
github_scipy,"BUG: `lqmn(1,1,0)` and  `lqmn(1,1,0j)` return incompatible derivatives",High
github_scipy,DOC: Selected text in version dropdown not compatible with dark mode,Low
github_scipy,ENH: spatial.transform.Rotation.align_vectors add a flag to automatically normalize the input vectors to unit length,Medium
github_scipy,`xp_capabilities` needs a proper documentation,Medium
github_scipy,BUG: `xp_capabilities` adds empty lines to docstrings,High
github_scipy,ENH: spatial.transform.Rotation.align_vectors: add scale and translation factors,Medium
github_scipy,BUG: sparse.csgraph.reconstruct_path: segfault for `nan` `predecessors`,High
github_scipy,ENH: sparse: improve performance of broadcasted binary operations,Medium
github_scipy,ENH: consistent callback signatures across scipy.optimize.minimize methods,Medium
github_scipy,MAINT: spatial.transform.Rotation: `from_euler/from_davenport` shape consistency,Medium
github_scipy,CI: macOS conda-forge job failing because of scikit-umfpack upgrade,High
github_scipy,BUG: barycentric_interpolate with complex and object array containing timedelta64 causes SystemError,High
github_scipy,BUG:  `squareform` with `dtype=object` array containing `np.float64` causes segmentation fault,High
github_scipy,DOC: stats: A reference in the `fligner` docstring occurs twice.,Low
github_scipy,BUG: deconvolve with empty divisor or signal arrays causes inconsistent errors,High
github_scipy,BUG: lfilter with empty a array can trigger misleading error or undefined behavior,High
github_scipy,BUG: scipy.sparse.csgraph.yen crashes with out-of-bounds source index,High
github_scipy,BUG: scipy.spatial.distance.sokalsneath crashes with StringDType input,High
github_scipy,"BUG: stats.levene: test results are incorrect when `center=""trimmed""`",High
github_scipy,BUG: linalg.norm: Inconsistent return type compared to NumPy,High
github_scipy,Should binary_closing support float16? Inconsistent behavior with float32/float64,Medium
github_scipy,BUG: special: logsumexp(inf) sign is NaN starting in v1.16,High
github_scipy,BUG: linalg.lapack: Segmentation Faults and Memory Errors,High
github_scipy,BUG: interpolate.spalde: segfault when k is too large or tck is invalid,High
github_scipy,BUG: scipy.interpolate.insert segfaults on invalid input type,High
github_scipy,BUG: interpolate: Internal error from `fpknot` while running `make_splprep`,High
github_scipy,DOC/DEV: Document how `scipy.signal` calls functions from `cupyx.scipy` during CI,Medium
github_scipy,ENH: Will RBFInterpolator support 3D or higher dimensional data interpolation in the future?,Medium
github_scipy,BUG: Hangs and failures on windows with non-AVX512 CPUs in conda-forge,High
github_scipy,"MAINT: Replace deprecated usage of numpy array shape, dtype and strides setting",Medium
github_scipy,BUG: signal: `invres()` failing dramatically when converting filter designed by scikit-rf,High
github_scipy,SHGO: issue passing args to objective function,High
github_scipy,DOC: SLSQP - different sign convention of Lagrange multiplier,Low
github_scipy,ENH: improve fitting of scipy.stats distributions using appropriate bounds and constraints,Medium
github_scipy,DOC: add LFX Insights badge to README,Low
github_scipy,BUG: NdBSpline segfaults for too high derivative orders,High
github_scipy,BUG: optimize: new COBYLA implementation ~30x slower execution,High
github_scipy,DEV: The `CODEOWNERS` contain files and directories which have been renamed,Low
github_scipy,BUG: stats.hypergeom: `rvs()` fails for N = 0,High
github_scipy,BUG: stats: `trapezoid.fit()` doesn't converge,High
github_scipy,ENH: Replace references to AS by references to digital library of mathematical functions,Medium
github_scipy,ENH: zipfian.rvs is slow for certain argument values,Medium
github_scipy,"DOC: optimize.differential_evolution: Clarify trial vector recombination - fill_point index is random, not fixed to last parameter",Medium
github_scipy,ENH: Slight inaccuracy in lfilter_zi gives different result of filtfilt,Medium
github_scipy,DOC: The file `scipy/_lib/_lazy_testing.py` has been removed,Low
github_scipy,BUG: signal.lombscargle(precenter=True) modifies input array on 1.15+,High
github_scipy,ENH: interpolate.make_smoothing_spline: `_compute_optimal_gcv_parameter` goes wrong,Medium
github_scipy,BUG: huge speed and quality regression for stats.multivariate_normal.cdf,High
github_scipy,ENH: Add covariance and error methods to `normal` and similar models,High
github_scipy,BUG: sparse: load_npz fails for coo_arry with dim>2,High
github_scipy,BUG: optimize: PRIMA implementation of COBYLA returns solutions closer than `tol` parameter,High
github_scipy,DEV: spin `cpu_count` check is not robust,Low
github_scipy,CI: CUDA compilation failures for all cupy tests,High
github_scipy,"BUG: ndimage measurements.py find_objects(input, max_label) not compatible with numpy 2.3.0",High
github_scipy,"ENH: special: `hyp2f1(a, b, c, z)` implementation for complex arguments (a, b)",Medium
github_scipy,DOC/ENH: signal.get_window: different default for symmetric/periodic than individual window functions,Medium
github_scipy,CI: _lib: `test_pyyaml_not_found` not automatically detected as thread-unsafe,Medium
github_scipy,DOC: <Please write a comprehensive title after the 'DOC: ' prefix>,Medium
github_scipy,DOC: signal.convolve2d: document that kernel is rotated,Low
github_scipy,ENH: Vectorized spline interpolation for both x and y,Medium
github_scipy,DOC/DX: `spin docs` doesn't incrementally rebuild docstrings from extension modules,Medium
github_scipy,ENH: spatial.transform: Add broadcasting support,Medium
github_scipy,DOC: interpolate.RbfInterpolator: incorrect equation in Notes,Low
github_scipy,BUG: optimize: missing error checking for slsqp inputs,High
github_scipy,BUG: optimize.nnls: memory leak,High
github_scipy,Incomplete license terms for sub components since version 1.16.0 (COPYING.txt for component qhull is missing),Medium
github_scipy,CI: new BLAS tests ci jobs don't respect ci skips,Medium
github_scipy,BUG: Discrete time TransferFunction objects calculate wrong phase response in recursive filters due to internal function bugs,High
github_scipy,BUG: scipy.signal.square ignores input dtype due to incorrect dtype check,High
github_scipy,"BUG: Error constructing sparse matrix with indices larger than 32 bits from smaller matrices, using sparse.block_diag()",High
github_scipy,BUG: stats: scipy 1.16 causes a large speed regression in mwaskom/seaborn `tests/test_statistics.py::TestKDE::test_bivariate_cumulative`,High
github_scipy,TST: stats: `marray` tests failing with latest array-api-strict,Medium
github_scipy,BUG: signal.periodogram: memory leak,High
github_scipy,BUG: stats.qmc.Sobol: stuck in infinite loop in low_0_bit after generating 2**32 samples,High
github_scipy,ENH: stats.kendall_tau: MergeSort to achieve O(n log n) complexity,Medium
github_scipy,BUG: stats.pmean: bad numerical behavior for small but finite p,High
github_scipy,ENH: spatial.geometric_slerp: allow for extrapolation,Medium
github_scipy,DOC: array API support table follow ups,Low
github_scipy,BUG: Typing mismatch: allow None for fill_value in RegularGridInterpolator,High
github_scipy,BUG: interpolate: `test_bispev_integer_overflow` crashes for ILP64 build on macOS,High
github_scipy,ENH: spatial.transform: array API standard support tracker,Medium
github_scipy,BUG: stats.sampling: segfault in various classes on osx-arm64,High
github_scipy,Why does `special_cyl_bessel_k_int` (and therefore `scipy.special.kn`) use `cyl_bessel_k` and not `cephes::kn`?,Medium
github_scipy,DOC/DEV: correct editable install `spin` guidance,Medium
github_scipy,"BUG: setting with `sparse.xxx_{matrix,array}` 2D singleton",High
github_scipy,CI: Enable GitHub Actions CI for ppc64le (Power architecture) support,Medium
github_scipy,QUERY: avoid explicit `expm(A)` computation when all you need `expm(A) @ v`,Low
github_scipy,BUG: Possible Issue with class RectBivariateSpline(BivariateSpline) in the _fitpack2.py,High
github_scipy,QUERY: interpolate: Are tck and degrees part of BivariateSpline's public API?,Low
github_scipy,BUG: signal.windows.taylor: output is NaN for nbar >= 2,High
github_scipy,BUG: (interpolate) _dierckx.data_matrix gives ValueError if input arrays are not C contiguous,High
github_scipy,DOC: interpolate: NearestNDInterpolator works with multi-dimensional arrays but docs suggest otherwise,Low
github_scipy,DOC: interpolate: add a demo for the connection between spline coefficients and control points,Low
github_scipy,BUG: special: hyp1f1 hangs with some arguments,High
github_scipy,BUG: issue building with gfortran on macOS,High
github_scipy,BUG: stats: ppf of 0 returns a value outside the distribution support,High
github_scipy,DOC: interpolate: RegularGridInterpolator with cubic interpolation : discuss `solver_options` better,Low
github_scipy,Chatterjee's Xi returns different results based on `numpy` major version,Medium
github_scipy,DOC: Confusing name for scipy.spatial.distance.is_valid_dm,Low
github_scipy,DOC: spatial.is_valid_dm: misleading documentation,Low
github_scipy,ENH: linalg: Follow-up tasks for ILP64 support,Medium
github_scipy,DOC/MAINT: sparse.linalg.onenormest: fails confusingly for LinearOperator with no `rmatmat` or adjoint,High
github_scipy,DOC: Incorrect dimension of PPoly.c in docstring,Low
github_scipy,CircleCI benchmarks job requires `hypothesis`,Medium
github_scipy,DOC: consider documenting Homebrew gfortran workaround,Low
github_scipy,DOC: optimize.minimize: erroneously claims COBYLA doesn't support equality constraints,Low
github_scipy,BUG: scipy.linalg.sqrtm incorrect on complex matrix on v1.16,High
github_scipy,BUG: linalg: wrong handling of args/kwargs in `_apply_over_batch`,High
github_scipy,DEV: `spin lint`: use `sys.executable` always,Low
github_scipy,BUG: sparse.linalg.splu: segmentation fault (SIGSEGV) for Pajek/GD99_c matrix with `permc_spec='NATURAL'`,High
github_scipy,BUG: special.kv: incorrect translation of AMOS Fortran code resulting in incorrect/NaN outputs,High
github_scipy,BUG: Compilation failure in HiGHs with MSVC,High
github_scipy,Delaunay find_simplex unexpected behavior,Medium
github_scipy,BUG: CSC matrix multiplication and indptrs,High
github_scipy,ENH: Switching from `pocketfft` to `ducc0.fft`,Medium
github_scipy,ENH: special: make `sph_harm_y` available to `cython`,Medium
github_scipy,RFC: sparse.linalg: batching and array types support,Medium
github_scipy,BUG: regression on Windows after ARPACK rewrite,High
github_scipy,BUG: spatial.transform.Rotation: Warning Inconsistency,High
github_scipy,BUG/TST: `spatial` test failure,High
github_scipy,BUG: free-threading: functionality based on multiprocessing.Pool / threading.Pool deadlocks,High
github_scipy,BUG [nightly]: spatial.transform.Rotation.from_quat: fails for float32 inputs,High
github_scipy,DEV: add `spin jupyterlab`,Low
github_scipy,ENH: Support eigendecomposition of 2x2 & 3x3 symmetric matrices via explicit formulas,Medium
github_scipy,BUG: optimize.least_squares: worse results for since v1.16.0,High
github_scipy,BUG: linalg.sqrtm: incorrect results in 1.16.0 when at least one isolated diagonal element and complex,High
github_scipy,BUG: signal.freqz: erroneously returns complex-valued frequencies,High
github_scipy,BUG: linalg.interpolative.reconstruct_matrix_from_id: segfault for invalid arguments,High
github_scipy,BUG: spatial.Voronoi: qhull internal error (qh_order_vertexneighbors): no neighbor of v4 for f39,High
github_scipy,BUG: signal.welch: artificially introduces DC component due to order of detrend and windowing,High
github_scipy,DOC: stats.wasserstein_distance: disagrees with linked article,Low
github_scipy,BUG/TST: `differentiate` `test_dtype` fails with `float16` on Intel Sapphire Rapids,High
github_scipy,ENH: spatial: triangulation class from predefined simplices,Medium
github_scipy,BUG: \scipy\_lib\_util.py fails tests and functions can't be imported,High
github_scipy,ENH: Return NotImplemented when scipy.spatial.transform.Rotation.__mul__ cannot deal with the type of other.,Medium
github_scipy,Grammar correction,Medium
github_scipy,RFC: stats.spearmanr: interface adjustment to enable array API support,Medium
github_scipy,DOC: Breadcrumbs missing and sidebar different in API reference docs for modules marked with `:orphan:` flag,Low
github_scipy,BUG: AttributeError: 'BooleanArray' object has no attribute 'nonzero' when running sc.pp.calculate_qc_metrics(),High
github_scipy,DOC: Fix bug in release notes for scipy v1.12.0,Medium
github_scipy,"BLD: build process stops early with ""numpy-config found: NO""",Medium
github_scipy,ENH: Parallel optimization of batch of parameters (and potentially functions),Medium
github_scipy,ENH: signal: numerically stable sos2ss and zpk2ss conversions (request for feedback),Medium
github_scipy,BUG: softmax outputs nan for inputs containing inf.,High
github_scipy,BUG: signal.tf2sos: `ComplexWarning`,High
github_scipy,BUG: linalg.lstsq: SVD did not converge,High
github_scipy,BUG: linalg.svdvals: Segmentation fault,High
github_scipy,"BUG: stats.beta.entropy: doesn't work with array-valued a, b",High
github_scipy,BUG: `@_transition_to_rng` leads to inconsistent function signatures,High
github_scipy,BUG: optimize.direct: memory leak while returning from user function,High
github_scipy,ENH: sparse: access to `csr_sample_values`,Medium
github_scipy,DOC: Missing docstrings for some warnings in scipy.io,Low
github_scipy,BUG/TST: stats: XSLOW test failures of `ttest_ind`,High
github_scipy,TestMedFilt::test_odd_strides is failing on deprecation in numpy 2.4.0-dev0,High
github_scipy,BUG: stats.norminvgauss: cdf becomes inaccurate in far right tail,High
github_scipy,BUG: New backend for interpolative decomposition breaks for (1xn) matrices,High
github_scipy,DOC/DEP: special.sph_harm: improve deprecation message guidance,Medium
github_scipy,BUG: Slow function call in `scipy.optimize.minimize` with `L-BFGS-B` since `scipy>=1.15.0`  on Ubuntu,High
github_scipy,BUG: scipy.optimize minimize routine does not show info logs related to optimisation with `display:True`,High
github_scipy,BUG: io.matlab: two `TestZlibInputStream` failures for Python 3.14 on Windows,High
github_scipy,BUG: min Python version enforcement in 1.16.x series? (and main),High
github_scipy,MAINT: array-api-strict compatibility on 1.16.0 release branch,Medium
github_scipy,BUG: `stats`: regression in JAX 0.6.2,High
github_scipy,"RecursionError in corner case test of `stats.sampling.FastGeneratorInversion` (py314, musllinux aarch64)",High
github_scipy,BUG: `interpolate.RegularGridInterpolator` fails on a 2D grid with a single point.,High
github_scipy,BUG: special.betainc: evaluates incorrectly to nan when `b=0`,High
github_scipy,ENH: `special.comb`: implement for input arrays when `exact=True`,Medium
github_scipy,BENCH/DEV: `spin bench` option `--quick` is useless (always active),Medium
github_scipy,DEV/DOC: segfault from `spin docs` on macOS with venv,Medium
github_scipy,BUG: sparse.linalg.eigs: random incorrect outputs generated,High
github_scipy,BUG: optimize: worse behaviour of new L-BFGS-B implementation,High
github_scipy,DOC: signal.medfilt: remove outdated note,Low
github_scipy,BUG: optimize.shgo: unbounded cache in Complex.split_edge,High
github_scipy,ENH: linalg: Polynomial eigenvalue problem,High
github_scipy,ENH: stats: `_put_val_to_limits` - accept `lower_limit` tuple,Medium
github_scipy,DOC: fft: tutorial example improvements,Low
github_scipy,ENH: linalg: randomized svd and eigh decomposition (faster but approximate),Medium
github_scipy,BUG: sparse.csgraph.connected_components: unexpected results for bsr arrays,High
github_scipy,"ENH: `linalg.{inv, solve}`: follow-up improvements to low-level ND support",Medium
github_scipy,DEV/DOC: `spin docs` fails,High
github_scipy,ENH: optimize.find_minimum: preserve shape of scalar-valued functions?,Medium
github_scipy,DEV/DOC: update vendored code pages for `_lib.decorator`,Medium
github_scipy,ENH: optimize: minimize for discrete scalar unimodal functions,Medium
github_scipy,CI: (re-)adopt `(d)tach` for modularity enforcement,Medium
github_scipy,BUG: `UserWarning` due to `spin build`,High
github_scipy,BUG: stats.pmean: wrong value for infinite orders,High
github_scipy,BUG: spatial.distance.cdist: wrong result in Yule metric,High
github_scipy,BUG: Scipy stft is not consistent with torchadio Spectrogram,High
github_scipy,DOC: Undocumented `dtype` change with `sp.sparse.csr_array(sp.sparse.spdiags(...))` vs. `sp.sparse.diags_array(...)`,Low
github_scipy,BUG: special: Discontinuity in associated Legendre functions,High
github_scipy,BUG: Sum of squares convergence error on valid data,High
github_scipy,"ENH: Stochastic Resonance & Information-Theoretic Analysis for Discrete Dynamical Systems (e.g., Collatz sequence)",Medium
github_scipy,CircleCI redirector for rendered docs stopped working?,Medium
github_scipy,BUG: optimize: too many open files with multiprocessing,High
github_scipy,ENH: optimize.NonLinearConstraint: add `args` parameter,Medium
github_scipy,BUG: `test_hermitian` for `lobpcg` failing on 32-bit Linux,High
github_scipy,BUG: Incorrect use of NumPy scalar types instead of np.dtype in _sputils.py,High
github_scipy,BUG: ndimage.median_filter: always returns `0` on single element arrays.,High
github_scipy,DEP/RFC: linalg.solve: deprecate `lower` and `transposed` params,Medium
github_scipy,BUG: sparse: `!=` operator with csr matrices,High
github_scipy,MAINT: Use multi-phase initialisation (PEP 489),Medium
github_scipy,BUG: linalg.solve_sylvester: not raising `LinAlgError` when no solution exists,High
github_scipy,ENH: stats.entropy: add `normalize` parameter to skip input normalization,Medium
github_scipy,DOC: Wrong SPDX identifier for OpenBLAS and LAPACK,Low
github_scipy,BLD: build issues in WSL on main,High
github_scipy,ENH: Function for bicoherence,Medium
github_scipy,DEV: `spin smoke-docs` adds an option twice,Low
github_scipy,DOC: Invalid example under sparse.coo_array.tensordot,Low
github_scipy,ENH: `vectorized_filter`: special case of scalar `size` with `axes`,Medium
