source,raw_text,priority_label
github_scipy,BLD: `-Duse-system-libs` does not look in provided `--prefix`,High
github_scipy,DOC: `linalg.toeplitz` does not support batching like the `1.16.0rc1` release notes say,Low
github_scipy,BUG: circular import error with `linalg._matfuncs_sqrtm_triu` on 1.16.0rc1,High
github_scipy,BUG: signal.csd: doesn't zero-pad for different size inputs in 1.16.0rc1,High
github_scipy,"TST: theilsope & siegelslope-related tests are failing on PyPy3.11 7.3.19: `TypeError: tuple() expected at most 1 argument, got 2`",Medium
github_scipy,MAINT: Some public sub-submodules still expose private objects,Medium
github_scipy,BUG: Inconsistent STFT results between ShortTimeFFT.stft() and signal.stft(),High
github_scipy,DEV/TST: print relevant env vars values in test header,Medium
github_scipy,ENH/REL: provide `scipy-openblas32` wheel for `ppc64le`,Medium
github_scipy,BUG: ConvexHull returns incorrect vertices in N-dimensional case,High
github_scipy,DEV: can we 'scrape' package-wide `make_xp_test_case` info?,Low
github_scipy,QUERY: building and using a wheel on Windows,Low
github_scipy,ENH: stats: Gaussian Continuous Ranked Probability Score (CRPS),Medium
github_scipy,DOC: integrate: incorrect code or math notation in `dblquad` non-constant limit example,Low
github_scipy,CircleCI docs artifact redirector action affect by change in security setting,High
github_scipy,Release notes do not explain what were the bug fixes.,High
github_scipy,ENH: super-Gaussian rv_continuous distribtuion,Medium
github_scipy,ENH: spatial: alpha shape/concave hull,Medium
github_scipy,Bug with freqz when specifying worN after #22886,High
github_scipy,DEV: `spin test -b all` adds `--pyargs scipy` twice,Low
github_scipy,DOC: optimize.nnls: squared 2-norm instead of 2-norm?,Low
github_scipy,BUG: optimize: `_linesearch_powell` can find worse local optimum than initial value,High
github_scipy,QUERY: ndimage.zoom: very low factor on big grayscaled images does not look good,Low
github_scipy,ENH: sparse.linalg: Krylov methods for matrix functions,Medium
github_scipy,"MAINT, CI: zizmor analysis of CI security",High
github_scipy,"BUG: The attribute ""nit"" is not found when using the callback of scipy.optimize.minimize",High
github_scipy,QUERY: `conda install scipy` changes python,Low
github_scipy,BUG: special._ufuncs._ncx2_pdf: interpreter crash with extreme input,High
github_scipy,DOC: documenting scalar vs 0-D array return types,Low
github_scipy,BUG: stats.wrapcauchy: output isn't wrapped around the unit circle,High
github_scipy,QUERY: optimize.minimize: adding constraints gives a better result,Low
github_scipy,TST: Nested arrays failing in array-api-strict git tip,Medium
github_scipy,TST: `special`: `test_compiles_in_cupy` is broken,Medium
github_scipy,BUG: signal.sawtooth: nan value?,High
github_scipy,ENH: special: Associate Legendre Function with non-integer degree,Medium
github_scipy,DOC: MSGS dictionary not linked or documented in scipy.optimize.fmin_tnc reference page,Low
github_scipy,BUG: interpolate._dierckx: `check_array()` can crash if the argument is not an array,High
github_scipy,BUG: spatial.distance.squareform: array elements with object dtype are incorrectly refcounted,High
github_scipy,DOC: spatial.Delaunay: links to wrong `transform`,Low
github_scipy,DOC: clarify the status of Apple's Accelerate Framework support,Low
github_scipy,BUG: `check_test_name` fails with `UnicodeDecodeError`?,High
github_scipy,BUG: optimize: `SyntaxWarning: 'break' in a 'finally' block under 3.14`,High
github_scipy,ENH: signal.find_peaks: improve ordering stability given ties,Medium
github_scipy,"DOC: <Improvement for the Documentation for Scipy.integrate.rk23, OdeSolution, BDF 'DOC: ' prefix>",Medium
github_scipy,BUG: Wrong use of `__builtin_prefetch()`,High
github_scipy,BUG: special.logsumexp: nan in 1.15,High
github_scipy,DOC: interpolate.make_splrep: result depends on scaling of data,Low
github_scipy,BLD: meson picks system-managed Python for py3 dependency,Medium
github_scipy,DEV: follow-up tasks after merge of `spin` support,Low
github_scipy,BUG: optimize.nnls: numerical instablity and performance issues in versions 1.12.0 through 1.15.2,High
github_scipy,ENH: Marray meta-thread,Medium
github_scipy,BUG: interpolate: Corner finding in Akima1DInterpolator silently fails,High
github_scipy,DOC: Update minimum NumPy and Python in toolchain roadmap,Low
github_scipy,BUG: interpolate: Akima1DInterpolator raises ValueError for valid inputs,High
github_scipy,ENH: Distribution Fitting with fixed parameters does not support vector of scales,High
github_scipy,ENH: linalg: LAPACK *ggsvd3 wrapper,Medium
github_scipy,BUG: scipy.special in 1.15.x doesn't support python 3.10 and numpy 1.26.4,High
github_scipy,"BUG:  TypeError: C function scipy.spatial._qhull._barycentric_coordinates has wrong signature (expected void (int, double *, double *, double *), got void (int, double *, double const *, double *))",High
github_scipy,BUG: test_logm_consistency is failing on Windows on ARM using clang-cl,High
github_scipy,ENH: optimize: add Constraints to `least_squares`,Medium
github_scipy,BUG: stats.sigmaclip: returns strange thresholds,High
github_scipy,ENH: stats: add matrix t-distribution,Medium
github_scipy,BUG: re-importing `scipy` fails,High
github_scipy,BUG: ImportError when using scipy.sparse with numpy 2.2.5,High
github_scipy,BUG: crash in python-dbg CI job due to calling Python C API without holding the GIL,High
github_scipy,BUG: signal.sosfiltfilt: memory leak flagged by memray,High
github_scipy,BUG/TST: Hanging tests on riscv64 (under qemu),High
github_scipy,ENH: stats.qmc.geometric_discrepancy: `method='mindist'` can improve memory complexity,Medium
github_scipy,"BUG: Sparse Interpolator (LinearNDInterpolator and CloughTocher2DInterpolator) return NaN on the points, which is linear combination of triangle point",High
github_scipy,BUG: linalg.expm: deviates from expected results on small complex matrices,High
github_scipy,CI: new GH runners available for macOS 15 and Windows 2025,Medium
github_scipy,"BUG: `stats.qmc.PoissonDisk`: overlapping sampling for negative `l_bounds`, `u_bounds`",High
github_scipy,BUG: stats.spearmanr: incorrectly identifies arrays as constant,High
github_scipy,ENH: optimize.minimize: memory+speed improvement for `MemoizeJac`,Medium
github_scipy,BUG: The status of `scipy.optimize.milp` is not accurate,High
github_scipy,ENH: optimize: Reduce the wheel size by porting `_group_columns` to C/C++,Medium
github_scipy,BUG: `signal.windows.kaiser_bessel_derived` uses `array` and is un-tested for `M<1`,High
github_scipy,BUG: <Install Spciy fail under Macos>,High
github_scipy,ENH: add `weights` param to `stats.quantile` similarly to NumPy,Medium
github_scipy,BUG: linalg.cossin: incorrect decomposition,High
github_scipy,BUG: optimize.nnls: unstable on i686 (32-bit) machine,High
github_scipy,TST: TestDistributions.test_funcs[cdf-methods11-x-Normal],Low
github_scipy,"RFC: ""relaxed"" error checking in some contexts",High
github_scipy,BLD: compiler warnings with clang 17,Medium
github_scipy,ENH: Use cython shared utility module,Medium
github_scipy,BUG: optimize: broken array types support in `least_squares`,High
github_scipy,BLD: build failure with suspicious flag `-fopenmp`,High
github_scipy,ENH: optimize: Return bound multiplier for SLSQP,Medium
github_scipy,DOC/DEV: outdated references to Cirrus CI,Medium
github_scipy,BUG: test_cython Failing on Windows on ARM64 with clang-cl,High
github_scipy,BUG: integrate.solve_ivp: solution behavior diverges and converges suddenly,High
github_scipy,CI: Failures in pytest-run-parallel CI job,High
github_scipy,MAINT: Collect low-level code under SRC folder per module respectively,Medium
github_scipy,BUG: optimize.linprog: slower,High
github_scipy,BUG: special.sph_harm: `got 0j instead of nan` test fail on riscv64,High
github_scipy,BUG: signal.minimum_phase: homomorphic mask error,High
github_scipy,TST: linalg.{lu_}solve: `TestBatch` tolerance failures with Intel LLVM compilers 2024.2,Medium
github_scipy,QUERY: stats.bootstrap with resample without replacement,Low
github_scipy,QUERY/BLD: build with Intel LLVM compilers 2024.2 gives `undefined symbol: __intel_avx_rep_memset`,Medium
github_scipy,BUG: linalg.eigh: incorrect results for matrices with large degeneracies,High
github_scipy,ENH: io.loadmat: extract data from MATLAB objects/classes,Medium
github_scipy,BUG: special.hyp2f1: problematic region in v1.15.2,High
github_scipy,ENH: linalg: integrate `mplapack` and `mpmath`/`gmpy2` for eigenvalues/SVD of multi-precision matrices,Medium
github_scipy,BUG: optimize.nnls: Maximum number of iterations reached behavior,High
github_scipy,"MAINT, CI: floating point exceptions activated in NumPy",High
github_scipy,ENH: more Hausdorff speedups,Medium
github_scipy,QUERY: no longer need to convert `desired` of `xp_assert_`s with `xp.asarray`?,Low
github_scipy,ENH: sparse.csgraph.depth_first_order: support POST-ORDER output,Medium
github_scipy,BUG: optimize.linprog: 20x slower in 1.15.x,High
github_scipy,BUG: special.j1: incorrect for small and large x,High
github_scipy,BUG: special.j0: incorrect for large x,High
github_scipy,ENH: `interpolate.make_splrep`: fails for ill-conditioned problems,High
github_scipy,DOC: integrate: `quad_vec` info return type is `_Bunch` not `dict`,Low
github_scipy,"BUG: sparse: Potential Memory Leak in `{csr,csc}_{array,matrix}.copy`",High
github_scipy,"CI: new failures: segfault in free-threaded, `linprog` invalid value encountered in `dot`",High
github_scipy,DOC: interpolate.make_smoothing_spline: example plot uses the same color for points and the fit spline,Low
github_scipy,ENH: sparse.csgraph.laplacian: generalize to signed networks,Medium
github_scipy,BUG: signal.resample_poly: dtype not preserved,High
github_scipy,BUG: special.betainc: inaccurate/incorrect for small a and b values when using single-precision floats,High
github_scipy,DOC: integrate.tanhsinh: documentation refers to non-existent attribute,Low
github_scipy,BUG: error for arrays on non-default device,High
github_scipy,QUERY: optimize.linear_sum_assignment: wrong result?,Low
github_scipy,QUERY: signal: window normalization for spectral routines,Low
github_scipy,QUERY: sparse eigen value decomposition difference,Low
github_scipy,BUG/TST: Test failure of Normal ccdf,High
github_scipy,QUERY: optimize.brute: returned parameters outside of ranges?,Low
github_scipy,QUERY: stats.brunnermunzel: produces warnings and nans with edge case input,Low
github_scipy,QUERY: stats.Normal: `ImportError` in 1.15.2,Medium
github_scipy,BUG: Sparse matrix advanced indexing is unexpectedly slow,High
github_scipy,BUG: spatial: `RigidTransform` does not support zero-length collections,High
github_scipy,BLD: spksrc issue cross-compiling,High
github_scipy,BUG: optimize.linprog: 40x slower in v1.15 compared to v1.14,High
github_scipy,BUG/REL: PyPI Linux wheels contain duplicate libgfortran/libquadmath,High
github_scipy,CI/DOC: CloughTocher2DInterpolator: `UserWarning` in docs build,Medium
github_scipy,ENH: ndimage.label: accept sparse arrays,Medium
github_scipy,BUG: `KeyboardInterrupt` in `_bspl._colloc_nd` (called from `interpolate.RegularGridInterpolator`),High
github_scipy,BUG: Transposed LinearOperator fails on vector multiplication,High
github_scipy,DOC: optimize.root: default values of optional parameters not documented,Low
github_scipy,QUERY: deprecated option `disp` in `minimize(method=’L-BFGS-B’)`,Low
github_scipy,"DOC: signal.savgol_filter: with `mode='constant'`, calculation seemed to mismatch docs",Low
github_scipy,BUG: scipy.stats: tmin/tmax: loss of precision for large integers,High
github_scipy,BUG: stats.binom.isf gives wrong result,High
github_scipy,BUG: io: `ZeroDivisionError` while loading MATLAB file,High
github_scipy,CI: oneAPI job: `Not enough disk space.`,Medium
github_scipy,BUG: spatial: `C function scipy.spatial._qhull._barycentric_coordinates has wrong signature`,High
github_scipy,BUG: special.logsumexp: inconsistency in phase when one element is complex infinity,High
github_scipy,DOC: sparse.linalg.ArpackError: entire default `infodict` displayed,Medium
github_scipy,BUG: Maximum capacity for scipy.signal.welch() has reduced significantly on 32 bit systems,High
github_scipy,"BUG: test failures in 1.15.2, Guix",High
github_scipy,DEV: running test suite without 'dev.py' is a pain,Low
github_scipy,QUERY: optimize.linprog: fails to find feasible point with negative variables,Medium
github_scipy,BUG: sparse.coo: `ImportError` for `upcast`,High
github_scipy,BUG: spatial: `Rotation` no longer supports zero-length collections,High
github_scipy,BUG: ndimage.median_filter: additional hard crashes,High
github_scipy,BLD: pip build from source fails in `_stats_pythran` with PyPy3.11,High
github_scipy,DOC: stats.gaussian_kde: clarify the meaning of `factor`,Low
github_scipy,BUG: special: cython complex failures on sparc64,High
github_scipy,DOC/BUG?: ndimage: correspondence between `axes` and `size`?,High
github_scipy,CI: benchmark job on CircleCI is failing on `io.mmread` memory usage,High
github_scipy,BUG: `lfilter` returns a leaked state from a previous call when the input `x` is an empty array,High
github_scipy,ENH: please add eval_nonzero_bspl to scipy.interpolate interface,Medium
github_scipy,BUG: scipy.optimize.curve_fit gives different covariance matrices with LM vs TRF method,High
github_scipy,BUG: stats.multinomial.pmf: inconsistent results?,High
github_scipy,CI: docs build failure,High
github_scipy,BUG: `ndimage`: Numerical regressions in Dask 2025.2.0,High
github_scipy,BUG: linalg.expm: bug on Windows / conda,High
github_scipy,MAINT: optimize: unnecessary `not_first_iteration` boolean variable in `scalar_search_wolfe2`,Medium
github_scipy,BUG: _lib: Data race reported by TSAN in `ccallback` mechanism,High
github_scipy,BUG: TSAN reports data race in `fast_matrix_market::line_count_result_s`,High
github_scipy,condition in scalar_search_wolfe2 can never be true,Medium
github_scipy,CI: failures `*/tests/test_extending` due to a regression in Meson master,High
github_scipy,BUG: ndimage.binary_erosion: segfault,High
github_scipy,BUG: Inconsistent pivoting indices `ipiv` between `scipy.linalg.lapack.?gttrf` and `scipy.linalg.lapack.?gbtrf`,High
github_scipy,BUG: ndimage.spline_filter1D magnifies data,High
github_scipy,CI: Some GitHub workflows failing due to check on `actions/cache` version.,High
github_scipy,ENH: add `axis` parameter to FloaterHormannInterpolator and AAA,Medium
github_scipy,performance: _construct_docstrings slow in scipy.stats,Medium
github_scipy,DOC: Inconsistent notation in Linear algebra (scipy.linalg) page,Low
github_scipy,BUG: `min_weight_full_bipartite_matching` fails for `coo_matrix` input with `AttributeError: 'coo_matrix' object has no attribute 'indices'`,High
github_scipy,ENH: spatial.transform: Add array API standard support,Medium
github_scipy,ENH: stats: T Testing of lognormal distribution with Modified Cox Method,Medium
github_scipy,BUG: special test TestHyp2f1.test_region4[hyp2f1_test_case42] fails tolerance built targeting x86-64-v3,High
github_scipy,ENH: Add test functions for optimization to `scipy.optimize`,Medium
github_scipy,DOC: interpolate.lagrange: the Lagrange function is using the Newton method of calculation,Low
github_scipy,BUG: wheel build failure on MacOS due to `std::lower_bound` compilation failure,High
github_scipy,DOC: remove links to the reference guide in the tutorials page,Low
github_scipy,MAINT: scipy.stats: test_regressZEROX SIMD warning for certain NumPy version ranges,Medium
github_scipy,Building PROPACK without using the meson-generated c parts,Medium
github_scipy,RFC:linalg: nD-array accepting functions to return partially completed work instead of discarding all and throwing an exception,High
github_scipy,BUG: Cannot use scipy.optimize in Anaconda Mac mini M1 sequoia,High
github_scipy,BUG: `lfiltic`'s handling of `a[0] != 1` differs from `lfilter`'s,High
github_scipy,ENH: Improve smoothing quality of `scipy.signal.savgol_filter` by weighted polynomial regression,Medium
github_scipy,BUG: `io/matlab/tests/test_mio.py::test_large_m4` fails on aarch64-darwin,High
github_scipy,Different results on Linux and MacOS for lbfgsb (see #14691),Medium
github_scipy,DOC: freqz_sos: claims that it was introduced in 0.19; no mention to sosfreqz; no documentation for sosfreqz,Low
github_scipy,BUG: Slicing sparse matrix with `None` gives result different from numpy's matrices,High
github_scipy,BUG: interpolative svd broken for non-square linear operators,High
github_scipy,QUERY: difference between `namedtuple`s and objects produced by `_make_tuple_bunch`?,Low
github_scipy,BUG: sparse.csgraph.construct_dist_matrix: buffer dtype mismatch,High
github_scipy,BUG: io.loadmat thinks a file with a lot of zeros is valid,High
github_scipy,BUG: Slow down in function evaluations within scipy.optimize.minimize after 1.15.0,High
github_scipy,DOC: The code of conduct link is dead,Low
github_scipy,BUG: special.itj0y0: regression for `t > 19`,High
github_scipy,BUG: sparray does not declare any method,High
github_scipy,DOC: integrate: missing bold font for a vector in tutorial,Low
github_scipy,BUG: Fisher Exact Test Error Inconsistent with Documentation (non-2x2 tables),High
github_scipy,BUG: spatial.transform: `Rotation.from_matrix()` uses inaccurate orthonormalization algorithm,High
github_scipy,Two `TestBatch` failures in macOS x86-64 Accelerate wheel build jobs,High
github_scipy,ENH: optimize.lsq_linear: add option to supply initial guess,Medium
github_scipy,RFC/API: move `clarkson_woodruff_transform` from `linalg` to `sparse.linalg`?,Medium
github_scipy,DEV: Generating GitHub release notes from Sphinx documentation,Low
github_scipy,DEV: asan experience with pytest a bit messy on Linux,Low
github_scipy,BUG: `scipy.stats.zmap` returns incorrect values for complex dtype `compare`,High
github_scipy,DOC: `gaussian_kde`'s `bw_method='silverman'` deviates from expected behavior,Low
github_scipy,"BUG: stats.genextreme.stats: Spurious warning from `genextreme.stats(0.0, moments='mvsk')`",High
github_scipy,BUG: special: failure of TestSystematic.test_besselj_complex on main,High
github_scipy,BUG: py39-scipy 1.13.1_0 fails to build on Mac Sequoia 15.2,High
github_scipy,"DEV: Allow ""Update branch"" button for maintainers?",Low
github_scipy,BUG: signal.convolve: large numerical errors when input has large magnitude difference and `method=fft`,High
github_scipy,CI: docs build failure on main from `sqlalchemy` via `sphinx`,High
github_scipy,ENH: sparse.spmatrix: allow fast import,Medium
github_scipy,"DOC/TST: interpolate, signal: `smoke-docs` failures",High
github_scipy,BUG: optimize.curve_fit: error on data with size = 1 and covariance matrix,High
github_scipy,RFC: Feature roadmap for 3D spatial transformations,Medium
github_scipy,BUG: signal filter functions raises TypeError when np.int64 dtype inputs are given,High
github_scipy,QUERY/TYP: sparse: Pylance reports unreachable after `toarray()`,Medium
github_scipy,BUG: ndimage: C++ memory management issues in `_rank_filter_1d.cpp`,High
github_scipy,BUG: special test TestHyp2f1.test_region3[hyp2f1_test_case23] fails tolerance on i386,High
github_scipy,BLD: SciPy manages to ICE GCC?,Medium
github_scipy,BUG: interpolation test TestSmoothingSpline.test_compare_with_GCVSPL fails on bigendian architectures.,High
github_scipy,BUG: stats: `test_axis_nan_policy_axis_is_None[mixed-*-xp*]` fails on mips64el,High
github_scipy,BUG: interpolate test_bary_rational.TestAAA.test_basic_functions fails tolerance with some BLAS,High
github_scipy,BLD: libhighs.a static library is installed,Medium
github_scipy,BUG: Matrix multiplication of a coo_matrix with an invalid type value does not raise a TypeError,High
github_scipy,ENH: scipy.io.netcdf support for CDF-5 format,Medium
github_scipy,DOC: `RuntimeWarning: divide by zero encountered in det` while building SciPy docs,Low
github_scipy,QUERY: Intellisense Autocomplete Not Working for `spatial.transform.Rotation`,Medium
github_scipy,BUG: special: Unchecked malloc in stirling2.h,High
github_scipy,BUG: `__pyx_fuse_1betainc` fused version yields incorrect result,High
github_scipy,ENH: stats: add double-sided crystal ball distribution,Medium
github_scipy,BUG: signal.medfilt and ndimage.median_filter not returning correct output,High
github_scipy,QUERY: integrate.solve_ivp: cannot pass args properly,Low
github_scipy,QUERY: cannot install SciPy 32-bit,Low
github_scipy,QUERY: stats.beta.fit: `FitError` on reasonable data,Medium
github_scipy,TYP: stats.rv_discrete: lower bound 'a' different types reported,Low
github_scipy,ENH: Pulsar Analysis lomb-scargle periodogram,Medium
github_scipy,BUG: ndimage.median_filter: Heap corruption with scipy 1.15,High
github_scipy,DOC: `/` and `*` denoting positional- and keyword-only arguments missing?,Low
github_scipy,ENH: integrate.nsum: convention when `b < a`?,Medium
github_scipy,BUG: stats: regression in performance of studentized_range,High
github_scipy,"DOC: sparse.linalg.LinearOperator: meaning of ""exponentiated""?",Low
github_scipy,BUG: genhyperbolic.fit is not stable and produces 'scale' parameter close to zero,High
github_scipy,BUG: scipy.special.pro_ang1 (and probably others) can corrupt memory,High
github_scipy,BUG: [scipy.stats.kruskal()] Memory Overflow,High
github_scipy,BUG: special: Potential memory leak  in the function `besy()` in `amos.h`,High
github_scipy,BUG: scipy.sparse.linalg.eigsh returns an error when LinearOperator.dtype=None,High
github_scipy,DOC: optimize.elementwise.find_minimum: harmonize documented/implemented interval termination condition,Low
github_scipy,BUG: importlib.metadata.version does not report the version of scipy 1.15.1,High
github_scipy,ENH: stats.special_ortho_group: improve and simplify,Medium
github_scipy,RFC: ndimage: operations in physical space,Medium
github_scipy,TST: TestDistributions.test_funcs[logcdf-methods10-x-Normal] fail,Medium
github_scipy,"DOC: `source` now links to top of file, not location within file",Low
github_scipy,ENH: interpolate: regular grid linear interpolation for a vector-valued function,Medium
github_scipy,TST: new test failures in 1.15.0 for blis on osx & windows,Medium
github_scipy,QUERY: Pyright raises error/warning in IDE,Medium
github_scipy,"BUG: On Windows, anaconda-packaged scipy.odr fails on simple example",High
github_scipy,QUERY/DEV: test failure in IDE with `SCIPY_ARRAY_API`,High
github_scipy,Query: empty `Rotation` is not allowed in scipy=1.15,Medium
github_scipy,BUG: linalg: `hecon` returns NaN incorrectly with some lower triangular data?,High
github_scipy,BUG: linalg.solve doesn't raise an error when A is a singular matrix,High
github_scipy,BUG: Constructing sparse matrix with big-endian float32/64 raises (confusing) error.,High
github_scipy,BUG: Importing scipy.optimize break highspy,High
github_scipy,ENH: stats: Add a new infrastructure version of the Von Mises distribution,Medium
github_scipy,MAINT: Fix a dtype check in `scipy.signal._waveforms.py`,High
github_scipy,BUG: median_filter on 1D array crashes with memory corruption using SciPy 1.15.0,High
github_scipy,DOC: build failing on main,Medium
github_scipy,ENH: tracking issue for JAX support,High
github_scipy,MAINT: specify lower bound for `pytest` in `pyproject.toml`,Medium
github_scipy,DOC: Interactive notebooks in stats tutorials are not working in version 1.15 docs.,Medium
github_scipy,"ENH, array types: differentiate.derivative requires promotion between floats and integral arrays",Medium
github_scipy,"BUG, array types: stats: `pmean` can fail for integral arrays",High
github_scipy,BUG: scipy v1.15 breaking for pytest when assert-rewrite is on,High
github_scipy,BUG: sparse.linalg.lsqr: variance returned appears systematically incorrect,High
github_scipy,"ENH: integrate.OdeSolver: opt-in to store history, trigger events, etc.",Medium
github_scipy,MAINT: remove end year from copyright,Medium
github_scipy,ENH: Improve differentialevolution _ConstraintWrapper performance,Medium
github_scipy,CI: add a job with `torch.default_dtype = torch.float64`,Medium
github_scipy,DOC: update roadmap,Low
github_scipy,ENH: signal.ShortTimeFFT: add stream processing capability,Medium
github_scipy,ENH: integrate: custom method to reject steps in certain OdeSolvers,Medium
github_scipy,BUG: signal.ShortTimeFFT: `istft` with `mfft > len(win)` not supported with leading dimensions,High
github_scipy,BUG: integrate_box after scipy.stats. gaussian_kde fit,High
github_scipy,BUG: special/xsf: Unchecked use of `new` in a few places.,High
github_scipy,"BUG (DOC?): `linalg.qr_update` fails for `k > M - N`,  `M > N`",High
github_scipy,Query: optimize.basinhopping: lowest minimum not accepted if first iteration does not converge,Medium
github_scipy,RFC: stats: sunsetting `scipy.stats.mstats`,Medium
github_scipy,ENH: signal.correlate: Native Support for Axis-Wise Cross-Correlation Between 2D Arrays,Medium
github_scipy,BUG: optimize.milp: segfault from HiGHS,High
github_scipy,ENH: stats: games-howell pairwise comparison,Medium
github_scipy,BUG: Segmentation Fault when passing a special array to `scipy.cluster.hierarchy.cophenet`,High
github_scipy,CI: sparse: smoke-docs failure on main,High
github_scipy,DOC/MAINT: stats/signal: 5 build warnings locally,Medium
github_scipy,ENH: stats: T Testing of lognormal distribution,Medium
github_scipy,MAINT: undo ignored errors in mypy,High
github_scipy,DOC: update `scipy` module docstring for lazy loading,Low
github_scipy,MAINT: io: Mypy faillure in main,High
github_scipy,ENH: sparse: matmul add broadcasting,Medium
github_scipy,DOC: linalg.cossin: improve readability of equation,Low
github_scipy,BUG:`stats.ContinuousDistribution.llf`: should not be public,High
github_scipy,QUERY: `stats.ContinuousDistribution`: adopt different broadcasting rules?,Low
