source,raw_text,priority_label
github_scipy,Query: optimize.minimize: trust_constr does not avoid Nonlinear constraints,Medium
github_scipy,"BUG: Fail to call `BSpline` after unpickling with `mmap_mode=""r""`",High
github_scipy,Can't pickle `array_namespace`,Medium
github_scipy,BUG: `stats._distribution_infrastructure._Domain.symbols` class attribute is shared by instances,High
github_scipy,DOC: linalg.matrix_balance: equation does not render,Low
github_scipy,ENH: Quantiles for probability distributions,Medium
github_scipy,BUG/DOC: it's not clear how to use `differentiate.jacobian` for a scalar valued function,High
github_scipy,BUG: stats: XSLOW test failure in `test_axis_nan_policy.py::test_non_broadcastable`,High
github_scipy,DOC: stats: random variable transition guide launches wrong notebook,Low
github_scipy,BUG: linalg.qr: large rounding error resulting in Hessenberg invariant violation,High
github_scipy,BUG: linalg.qr: large rounding error resulting in Hessenberg invariant violation,High
github_scipy,ENH: optimize.minimize: parallel evaluation of finite-difference based gradients,Medium
github_scipy,Consider `x.ndim > 1`  generalizations of spline and polynomial interpolators,Medium
github_scipy,BUG: linalg.qr: large rounding error resulting in Hessenberg invariant violation,High
github_scipy,BUG: `scipy.interpolate._bsplines._make_periodic_spline` crashes the Python Interpreter after correctly raising ValueError,High
github_scipy,BUG/DOC: sparse: ND COO unexpected behaviour 1.15.0rc1,High
github_scipy,DOC: UnivariateSpline smoothing condition probably incorrect,Low
github_scipy,QUERY: slowness in recent versions mixing OpenBLAS with `multiprocessing`,Low
github_scipy,API: unmentioned removal of `scipy.version.commit_count` in `1.15.0rc1`,Medium
github_scipy,DEP: `interpolate.interpnd.GradientEstimationWarning` still present in `1.15.0rc1`,Medium
github_scipy,BUG: Pythonw does not run on Windows 11 when scipy.fft is being imported,High
github_scipy,"DOC: sparse: `sparse.eye_array` does not accept `tuple[int, int]` as the docs say that it should",Low
github_scipy,API: unannounced breaking change: `scipy.integrate.AccuracyWarning` removed in `1.15.0rc1`,Medium
github_scipy,DOC: integrate.quad: uses Gauss-Kronrod not Curtis-Clenshaw?,Low
github_scipy,MAINT: signal: build warning (`sprintf`) on macOS,Medium
github_scipy,"DOC, REL: a few release notes/process issues",High
github_scipy,DOC: PchipInterpolator: missing integrate function,Low
github_scipy,DOC: sparse: Several functions are missing the 'Returns' section of their docstring,Low
github_scipy,BUG: dsyrk slower than naive numpy matrix-matrix multiplication on matrices with many columns,High
github_scipy,"DOC: `stats.order_statistic`: docstring missing the ""Returns"" section",Low
github_scipy,DOC: ndimage.minimum and maximum: incorrect return type,Low
github_scipy,"BUG: ndimage, array types: `minimum_position` and `extrema` incorrect return namespace",High
github_scipy,MAINT: Cython lint failures in build output,High
github_scipy,BUG: AttributeError: module 'numpy' has no attribute 'AxisError' in stats.wilcoxon,High
github_scipy,DOC: stats: clarify the support of a distribution is unaffected by loc and scale,Low
github_scipy,TST: `optimize.elementwise.bracket_minimum`: CuPy failure,Medium
github_scipy,TST: test_extending failures on free-threaded Windows wheel build,Medium
github_scipy,Query: signal: improve stability for filters for a broad frequency range?,Medium
github_scipy,BUG: mypy failure in main,High
github_scipy,`Test_SVDS_LOBPCG.test_svd_rng_3` test failure in wheel build job,High
github_scipy,DOC: updating release process docs for versioning simplification,Low
github_scipy,TST: tolerance violation in `test_x0_working[tfqmr]` on windows,Low
github_scipy,DOC: stats.mannwhitneyu: unclear about the baseline,Low
github_scipy,"DOC, BUG: doc build failure due to scipy.misc changes",High
github_scipy,ENH: Add support for free threaded python,Medium
github_scipy,"ENH: special.gammainc: allow negative arguments and computation via [DLMF, eq. 8.7.3]",Medium
github_scipy,BUG: interpolate.Akima1DInterpolator: different values on subsequent calls,High
github_scipy,BUG: eigh can't work when N = 45000,High
github_scipy,ENH: sparse.linalg.eigsh: performance issue,High
github_scipy,TST: `TestJacobian::test_attrs` tol bump?,Low
github_scipy,DOC: stats.pearsonr: incorrect `versionadded` for `axis` param,Low
github_scipy,BLD: `ld: warning: ignoring duplicate libraries: '-lgfortran'`,Medium
github_scipy,DOC: `ndimage.median_filter`: document behaviour with `nan`s or even `size`,Low
github_scipy,ENH: `io.mmread`: Provide better error message when loading a matrix market file that doesn't exist,High
github_scipy,scipy.linalg.solve CRASH when used with IntelOneAPI 2024.2 MKL on Windows 11,High
github_scipy,BUG: `optimize.curve_fit` with `method='lm'` fails to determine `pcov` when `popt` has zeros,High
github_scipy,refguide_check currently failing,High
github_scipy,ENH: optimize.root: warn when inner parameters are ignored with `method='krylov'`,Medium
github_scipy,No description,Medium
github_scipy,STY: fix and enable lint rule UP031,High
github_scipy,ENH: `ndimage.median_filter`: extended `dtype` support?,Medium
github_scipy,BLD: failure with py314t & Cython 3.1.0a1,High
github_scipy,BUG: _filter_design.py:1112: BadCoefficients: Badly conditioned filter coefficients (numerator),High
github_scipy,BLD: failure with py314t & Cython 3.1.0a1,High
github_scipy,ENH: special: replace cdflib,Medium
github_scipy,DOC: Deprecation warning in `sphinx` when used with Python 3.13,Low
github_scipy,BUG: `linalg.subspace_angles`: numeric error,High
github_scipy,DOC: I had a problem with being unaware of changed behavior between versions. A changelog would be great,Medium
github_scipy,BUG:  `eliminate_zeros` raises when `indptr.dtype` != `indices.dtype`,High
github_scipy,BUG: Multiple DiscreteAliasUrn instances cause MessageStream.close error,High
github_scipy,"CI: failure for ""Oldest GCC ..."" Linux CI job (related to pre-release NumPy)",High
github_scipy,DOC: `stats.goodness_of_fit`: improve examples,Low
github_scipy,BUG: linalg.eigvals: incorrect handling of singular positive semidefinite matrices,High
github_scipy,BUG: stats: XSLOW test failure in `scipy.stats.tests.test_fit::TestFit`,High
github_scipy,BUG: several failing tests in `interpolate` on macOS15,High
github_scipy,BUG: optimize.shgo: ignores a constraint,High
github_scipy,"DOC, REL: 1.15.0 author mappings",Medium
github_scipy,BUG: `*ger*` routines in `linalg.blas` are not thread-safe,High
github_scipy,"BUG: Intel oneAPI tests / py3.12, dev.py: `meson.build:1:0: ERROR: Compiler icx cannot compile programs.`",High
github_scipy,TST: failures in `test_riemann_zeta_complex` on windows in conda-forge,Medium
github_scipy,ENH: sparse: New nD sparse array functions,Medium
github_scipy,BUG: Clayton Copula Cannot Handle Negative Theta Values,High
github_scipy,BUG: interpolate.griddata: NaNs inside convex hull (despite no NaNs or duplicates in data),High
github_scipy,BUG: integrate.trapezoid: broadcasting failure after #21524,High
github_scipy,BUG: Inconsistent results from dgesv on different platforms,High
github_scipy,BUG: stats: New XSLOW test failure in test_sampling.py,High
github_scipy,MAINT: smoke-docs failure on main,High
github_scipy,RFC: 64-bit LAPACK and `cython_lapack`,Medium
github_scipy,BUG: MacOS test failures with GNU toolchain,High
github_scipy,BUG: `interpolate/tests/test_interpnd.py::TestLinearNDInterpolation::test_threading` failure,High
github_scipy,BLD: Compile error for scipy 1.12 with Intel oneAPI 2025.0.0,High
github_scipy,"ENH: When computing bootstrap CIs with BCa, allow estimating acceleration with random subsets of jackknife rather than full jackknife",Medium
github_scipy,BUG: `scipy.datasets` failing with Error 403 for readthedocs builds,High
github_scipy,BUG: stats: _stats_pythran.cpp issue with development dependencies?,High
github_scipy,BUG: signal.fftconvolve/oaconvolve: inconsistent broadcasting,High
github_scipy,"ENH: implement `extend=""recurrence""` for `factorial{2,k}`?",Medium
github_scipy,ENH: KDTree compatible with Mahalanobis distance,Medium
github_scipy,BUG: large number of fails with macOS 15.1 using Accelerate,High
